review_id,author_name,rating,review_title,review_text,app_version,review_date
12656591164,Shanerbug89,3,App is great,App functions well and has great features.,4.6.342,2025-05-14T14:59:46-07:00
12656381120,ReBoooot,1,Lied on upgrade program,"Super disappointing they lied on the upgrade rule. Then the new version was impossible to get to work even with Support help
Not ready for prime time",4.6.342,2025-05-14T13:33:18-07:00
12654917333,ssylla19,1,Lies lies and lies.,"The whoop coach/AI said that since i had a 4.0 and have about 6 months left on my subscription, I’m eligible to a free upgrade to whoop peak. I took a screenshot and sent it to whoop. They pretty much told me that, no, it doesn’t work. Lime that. And won’t refund me my 50 dollar upgrade. I’m returning that device as soon as it gets to me. And won’t renew my subscription. Went back on their words about free upgrade for greed.",4.6.342,2025-05-14T05:20:56-07:00
12653170976,Imtodd,5,Whoop 4.0 and now MG user,Had Whoop for a while now and am thankful I came across this product and app. The company has come under scrutiny recently for the way it handle the roll out of the 5.0 and MG but the app has been great. I personally love their products and will continue supporting this company.,4.6.342,2025-05-13T16:15:37-07:00
12653145339,egsdee_,1,5 Year Customer - Cancelling,"This review would have been 5 stars had it been written it in 2021. However, Whoop - their product, their management team, and ultimately their value proposition have changed, and thus so has my perception of it.

I’ve had some great success since joining Whoop in 2020. The device provided some extremely useful insights, particularly around sleep, that I have used to improve my life. 

Whoop as a company was, in my view, consistently on the cutting edge of wearable fitness tech. I believe what once was a laser-focus on product and software development has eroded to one of marketing gimmicks and misinformation. So much of their spending and time now goes into having pro athletes be seen wearing a Whoop as opposed to actually improving product accuracy, performance, and experience.

Further, I cannot in good faith recommend a company who markets a <10% size reduction as a crowning product achievement that took years to develop, when all of its users know it’s simply to make all 4.0 accessories obsolete. 

Whoop has investors to answer to. I get it. It’s a corporate world, but they have been in the process of a multi-year misassessment of their niche in the marketplace. You can’t grow when the bucket is leaking, so I’m voting on what the company has become with my wallet.

Garmin and Apple have not only caught up, but surpassed Whoop in all the ways that made it unique. Their sensors are better, UI/UX equally intuitive and beautiful, and features much broader and more extensive. Oh, and you can get a new one every year as opposed to paying a subscription that no longer covers the cost of new hardware when it releases.",4.6.342,2025-05-13T16:04:25-07:00
12653135193,FruitNinja73758,1,Terrible battery on iPhone since 5.0,Got a Whoop 5.0. Ever since my phones battery life is plummeting. Looking in battery and power settings it shows the Whoop app is active all day with 1 minute of screen time and has used 78% of the battery today. Absolutely wild,4.6.342,2025-05-13T16:00:02-07:00
12653103940,Snake3at3r,2,Empty Promses,"I’m 2 months into a 12 month contract. The free hardware upgrades sold me not the company and made the decision to commit for a year easy. The new hardware devices dropped and they changed their policy without notice. The “free” upgrade is only for members who sign an additional 12 month contract on top of their existing contract. A similar situation happened when the 4.0 dropped. The policy went from free hardware upgrades to free only if you have 6 months or more left on your contract without notice of change. 

The software is pretty robust and useful. The company cannot be trusted.",4.6.342,2025-05-13T15:46:38-07:00
12652911736,bonner1040,1,No Free Upgrades,They deceptively change their policies and do not offer free upgrades. You must pay for upgrade and pay higher monthly rate for new features. Opposite of what was promised all along.,4.6.342,2025-05-13T14:24:18-07:00
12652809949,bmalts,1,Horrendous,"Scam of a company, do not sign up under any circumstance. They do not keep promises, it is extremely difficult to cancel your membership and support is horrendous. RUN!",4.6.342,2025-05-13T13:42:42-07:00
12652749331,DH5-1,2,Lies Upon Lies,Whoop recently changed their service model after years of making promises about new hardware and new software features always being part of the ongoing subscription. I’m never going back.,4.6.342,2025-05-13T13:18:45-07:00
12652708217,reyman1337,1,Misleading Advertising and Poor Customer Treatment,"I’ve been a loyal Whoop subscriber for over 6 months, partly because they promised free hardware upgrades after that period. Now they’ve released new bands and gone back on their word—no free upgrade, just a higher price tag. This is categorically false advertising and completely misleading to consumers. On top of that, they’ve raised subscription prices without delivering the value to justify it. Disappointed and feeling taken advantage of. Do better, Whoop.",4.6.342,2025-05-13T13:02:55-07:00
12652599676,Malau14,1,Feels like fraud,"The original promise of Whoop was to always have the newest tech included in the membership. It was even on their FAQ. However, they've gone back on that since, which means this will be the last time I use it.",4.6.342,2025-05-13T12:21:59-07:00
12652535439,chewycopper,1,Bait and switch,No real changes with the new device except higher price points and un kept promises,4.6.342,2025-05-13T11:58:20-07:00
12652508217,robfromabove,1,App is fine but company doesn't stand behind their products,"I was a member for 3+ years; I purchased one of their (overpriced) bands that quickly fell apart, less than six months after purchase. After a full month and a half of dealing with customer service, I was told it wasn't covered by their warranty. Don't waste your time or money on a company that doesn't value and respect their customers.",4.6.342,2025-05-13T11:48:22-07:00
12652470580,jslbfm,1,Disappointed,Used to be a good product with great customer service. The new device feels cheap and the new “features” are gimmicky. I’d be hesitant to invest.,4.6.342,2025-05-13T11:34:40-07:00
12652464094,corrupt episodes,1,Greed,Greedy company is going down quickly. Nothing changed between 4 and 5 and is this is strictly a marketing company. Don’t feed the beast and watch them go down within a year,4.6.342,2025-05-13T11:32:16-07:00
12652426191,Tepop84,1,Bait and switch,Not to be trusted,4.6.342,2025-05-13T11:18:35-07:00
12652397426,JanoyCresvaSith,1,Misleading business practices,Whoop supposedly claims they offered free hardware upgrades with subscriptions but are now claiming they never said that. A lot of folks bought the subscription under those pretenses.,4.6.342,2025-05-13T11:08:07-07:00
12651846935,.|.|.|. .|.|.|.,1,Looong delays for data upload to phone! Will not renew subscription.,"It takes a looong time for any data to upload from whoop to your phone. Processing sleep data can take 10+mins and activities or updates throughout the day take forever too. They have used inferior hardware or can’t figure out how to transfer data. Apple Watch, Garmin, Fitbit, and Oura don’t have this problem. Definitely will not renew the subscription.",4.6.342,2025-05-13T08:03:54-07:00
12651516585,Arabino24,2,Neat but Frustrating,"Bugs are difficult to troubleshoot and when products don’t function correctly there is pushback from customer service on replacement. The data is neat but I would not recommend it to friends because it is frustrating and can be unreliable with slow and glitchy syncing. When I began having increased holes in my data they told me to fit it to my wrist in a different way that runs counter to all of their advertising and the way I had been wearing it when it was fully functioning. Paying a subscription in advance then having lack luster customer service is disappointing, hardware replacements are hard to get and upgrades are not free as advertised initially.",4.6.342,2025-05-13T06:20:08-07:00
12649328386,MPM516,1,Dishonest company,"Company flat out lied to customers about the upgrade process. There’s a reason Bloomberg news wrote an article about how dishonest they are. They had the nerve to say customers misunderstood even though you can clearly see the web page on the web archives which mentions it’s free, no mention of adding or having a year",4.6.342,2025-05-12T14:11:21-07:00
12648123905,Mictob88,1,Misled by Company,I signed up for Whoop with the understanding that my device would be upgraded for free. This is no longer the case. I feel that I have been misled.,4.6.342,2025-05-12T07:09:18-07:00
12645888521,Pennagirrl,1,False advertising and bad updates,"The new updates make it hard to quickly view my stats. 

The new membership structure puts stats that used to be included on the standard membership behind a paywall, and makes new equipment contingent on purchasing ANOTHER year. I cancelled my membership and am requesting whoop refund me a prorated membership fee.",4.6.342,2025-05-11T14:40:52-07:00
12645879097,Frawha3,1,New interface,I don’t like it,4.6.342,2025-05-11T14:36:52-07:00
12644688791,Meeeeeee0101010,1,Stay Away!,Don’t waste your money on this company. They do not honor what they advertise. Not a trustworthy company. Their customer support is very slow as in it takes several days before you get a response. And their heart rate tracker isn’t that accurate,4.6.342,2025-05-11T07:52:27-07:00
12644156329,M Spallucci,1,App update change,I love my whoop. I bought it for my dad for Christmas and it’s helped him start getting mobility back. The new app update is horrible. I was able to make it simple for him; the goal is to match your strain with your recovery line. It isn’t perfect advice but it got him moving with a goal. I’m begging that they change it back.,4.6.342,2025-05-11T05:12:01-07:00
12644124211,Chappy the salesman,1,Bait and switch- 3 year user,"No problem with the tech, but the business model. I already wasn’t happy paying $30 a month for a hardware device, because I expected I would soon be upgraded for my trouble and multiple years in, it was time for an upgrade. Then whoop rolls out two new devices and no upgrades for existing users. Shady.",4.6.342,2025-05-11T05:01:10-07:00
12642423487,ilya4544,1,Fraud,Changing terms after you buy device,4.6.342,2025-05-10T17:13:57-07:00
12641761575,xrangerx777x,1,Sham Company,"I got Whoop for Christmas from my parents. The subscription cost the same as my present budget for both my birthday and Christmas. I willingly gave up my birthday present this year in order to get a Whoop.

I was excited for two features. I do BJJ and I liked being able to wear my Whoop in an arm sleeve to track my workouts.

I was also excited for the promise of not having to pay for new hardware. However, the Whoop 5.0 came out, and Whoop said “you need to pay for another year of service to get the 5.0 or pay a fee for the new hardware. On top of that, the actual new product is more expensive and we’ll prorate your subscription to get it.”

Okay… I was planning on waiting the month until I had my subscription for the six months originally advertised as the threshold for the upgrade. After such a large backlash, they decided to generously waive the fee if you have 12+ months in your subscription OR if you recently go your Whoop 4.0.

In short, Whoop promised one thing, decided to do something else, and then still screwed me over.",4.6.342,2025-05-10T12:39:53-07:00
12640692536,Mythic Mirage,1,Lying Company Semi-Good Features,"Yeah, so with the introduction of the 5.0 and the MG, this is the absolute worst thing that the company could have done to. It’s loyal subscribers. I myself rely on this data for bodybuilding and I was very happy with the premise of being able to upgrade to the new version for free. That was always a plus, but now that they have absurd, price, hikes, upgrade fees, and false promises, I have canceled my subscription and I do not intend on. Renewing unless this company lives up to their prior word. Also to note, I have an Apple Watch that does very similar things, and I feel like Apple is actually getting ahead of the game on. Whoop. Which is unfortunate, because who originally had a competitive advantage over Apple. Might take as of now., Do not buy, it is not worth it at all.",4.6.342,2025-05-10T07:04:29-07:00
12639453889,smokethatKUSH19995,1,Liars,"Gained a loyal customer base by charging a decent subscription fee with a promise of perpetual FREE upgrades to hardware and software. 5.0 comes out, guess what? You gotta pay to upgrade. Cancelling my subscription.",4.6.342,2025-05-09T23:27:33-07:00
12638489019,wish1202,1,Bait and switch,"1. Not a free upgrade. 
2. Confusing checkout flow.
3. No confirmation on 5.0 after paying money.
4. Bad customer service. 

Frustrating. Doesn’t matter how long you’ve been with them.",4.6.342,2025-05-09T16:32:09-07:00
12637228246,nirvamaster,1,Terrible User Experience,I am deeply disappointed by the latest app update. I already pay $200+ a year and now I see blurred items on the app making me feel heavily under appreciated. Terrible user experience whoop. You guys messed up big with this announcement…,4.6.342,2025-05-09T08:38:21-07:00
12637148248,djrodgers12,1,New update ruined connectivity,"Ever since the new update, I’ve had to wait hours to get my recovery score with the app somehow losing connectivity / not being able to grab all the data quickly. Fishy that all of a sudden when they announce the new devices the old ones start not working",4.6.342,2025-05-09T08:13:36-07:00
12636560650,Doobie0909000,1,False advertising,"Was told members were going to get upgraded to new hardware, but changed the policy as they released the 5.0.",4.6.342,2025-05-09T05:13:13-07:00
12635498258,Sakano0os,5,Please make it Arabic version,Please make it Arabic version i want my family use whoop bout not all can understand English so please make it Arabia version,4.6.342,2025-05-08T21:16:49-07:00
12635247551,GBen41,1,Total Hoax,"They don’t live up to what they sell, they don’t replace devices, they absolutely do not give you a new device with the subscription if they come out with new hardware. It’s a total hoax buy an Apple Watch and save yourself $",4.6.342,2025-05-08T19:15:47-07:00
12634986562,Cox1014,2,All about $,"Family membership, can’t upgrade without upgrading entire family. Constant ads and trying to get to spend $.  Recordings inconsistent.  Poor improvement since last used few years ago.  Will go to different option.",4.6.342,2025-05-08T17:21:14-07:00
12634867091,asshu89,1,Time to cancel!!,"Well been using 4.0 and now looking at 5.0 and tiers and pricing, I feel like it’s time to cancel the subscription…",4.6.342,2025-05-08T16:28:36-07:00
12634806941,Panthereal,2,Whoop lied to me.,When I signed up they promised free hardware upgrades with their expensive membership fee.  Then they removed that promise from their website weeks before releasing the only hardware upgrade since I signed up in 2022.  Do not recommend trusting this company.,4.6.342,2025-05-08T16:02:20-07:00
12634550241,Person37382,1,Think Twice Before Renewing,"My membership hasn’t expired yet and I accidentally renewed on a whim. I messaged whoop within 20 minutes. They basically told me I was out of luck. No refunds on renewals.

Looks like I’ll be using it for another year. This whole business model is just a money grab. I won’t be renewing next time and really didn’t appreciate the customer service response. 

My current membership isn’t even done and I can’t cancel the renewal just 20 minutes after clicking the button? This experience has put a bad taste in my mouth about the company as a whole.",4.6.342,2025-05-08T14:12:05-07:00
12634276214,unfrugall,1,Bait and switch,Paid the outrageously expensive monthly subscription since i was promised free device upgrades. 5.0 upgrade is NOT FREE!!!!!!!!!????????,4.6.342,2025-05-08T12:23:58-07:00
12633781776,Lenincasanova,5,The best ever..,If you wanna track your progress and make sure that you’re getting a good result… Woop!!!,4.6.342,2025-05-08T09:26:16-07:00
12633727201,GarrettC2020,1,False Advertising,You CANNOT upgrade for free! You have to pay a fee or purchase an entire year subscription!,4.6.342,2025-05-08T09:08:21-07:00
12633030341,Hdjx,1,Bummer app update,Switch back to old layout please this new one is too clunky,4.6.342,2025-05-08T05:32:15-07:00
12630659461,Lorenzo_Palumbo,1,Horrible customer service.,"Device broke after 6 months of use. Unable to pair and record data. Emailed customer service repeatedly they told me the same steps to fix it which never fixed the issue. After weeks of emails with no solution, i gave up. Horrible experience. Just buy a Garmin.",4.6.342,2025-05-07T12:25:46-07:00
12629372551,NTTN2112,3,New version worsens experience,"Whoop used to have a clean, customizable interface that was easy and fun to use. The new release is chaos—completely obscures key data or takes 3x more space to show the same information and now it’s all harder to read and find.

Did you have all your views setup so that you could glean all relevant info with one glance and not have to scroll around and click into graphics to see what you care about? Now you don’t. 

Recently entered my 4th year of subscription…until now I would’ve said the app was getting better. But this new interface is bad UX.",4.6.342,2025-05-07T05:21:19-07:00
12629221382,Ayansi22,1,New layout,New update is absolutely trash why did they change home layout ? Nobody knows.,4.6.342,2025-05-07T04:30:05-07:00
12627652648,Shakers11,3,Please bring back the old layout,"I’ve been using whoop for over 2 years now, and recently saw their new user interface, home screen, alongside many other updates within the app. This update is far too overstimulating and hard to gather information without spending many minutes in the app. I preferred the old version which effectively synthesized the important information I want to stay updated on daily and quickly.",4.6.342,2025-05-06T16:35:48-07:00
12626350976,Crob9120,2,App redesign is atrocious,Recent app redesign is atrocious. Who thought this was better?,4.6.342,2025-05-06T08:30:18-07:00
12625629191,achadd7,5,New App Update,"I was a huge fan of WHOOP, and I’m always recommending to my friends. The new app update however makes it much more difficult to quickly read through my stats in the morning before I start my day. Having one circle at the top showing both strain and recovery along with other key metrics was super self service. The three circles makes it much harder to find the information that I want. 

Just wanted to offer some feedback as a long time WHOOP user.",4.6.342,2025-05-06T04:39:07-07:00
12624841835,ilovemyaps,2,Update,"Update  is mid.  Now instead of scrolling to get info, you need to
Click and then scroll.  So much more efficient 🙄Don’t really think it was a revolutionary update.  Seems more like an update to justify some designers job.",4.6.342,2025-05-05T22:39:52-07:00
12624106598,Sauron93,1,Hate the new home screen,"The top of the home screen has been dumbed down to be nearly useless. I care about hrv and rhr with my recovery. 
Sleep is not a percentage, I care about hours and restorative sleep. Now I have to dig to find see what matters.

Also, the people that designed this app must hate their users. The messaging in the app always blames the flaws on the user, saying things like ""Your Whoop is off body"".  No, it's not, it's on my wrist! And there isn't a way in the app to say ""No, it's you, wake up you piece of junk.""",4.6.342,2025-05-05T17:08:17-07:00
12622696776,The Duder 2.0,5,Life changing.  Would love health activities…,"I’m into this a week and it’s been life changing.  I’ve been battling neurological/cardiac symptoms and I’ve been able to accomplish more recovery in 6 days with these metrics than in 6 months of medical treatment.  I’d love to see the ability to add custom activities, though.   As an example, I’m using cold therapy to stimulate the vagus nerve.   I don’t have the ability to track that, electrostim or any of the other processes that seem to generate a lower stress response.  The journal is also insufficient, so I have to use something external with this to track responses to weather (temp), medication, etc.  All-in-all, this is incredible.  Thank you for creating it, I’m getting my life back bc I can finally see what works in real time.",4.6.342,2025-05-05T08:25:02-07:00
12618425928,Redgy R.,4,Nearly Prefect,I have been a WHOOP member since 2020. It’s my primary heart rate monitor for sleep and activity. I don’t use an Apple Watch or a Garmin HRM. I would say WHOOP HRM works great except for a few things. I think it reads heart rate low sometimes during an activity. It also sometimes doesn’t detect sleep. I like how they’ve integrated AI. I’m staying with WHOOP because I don’t think there is a better option. But I wish they’d make it perfect. It’s not cheap.,4.6.342,2025-05-04T06:10:30-07:00
12613897991,Toquinho1991,1,Scam,"Don’t buy this! If you don’t like it you won’t be able to cancel the membership. It’s a 1-year commitment, so you’ll have to “buy out “ the remaining months in your subscription. Insane!",4.6.341,2025-05-03T02:21:46-07:00
12612260180,camwedel,1,"Arduous, Buggy, Inaccurate Exercise Tracking & Complex. Garmin Superior.","Since I have owned my Whoop (5 months) I have had regular issues with it syncing. It seems if you are not constantly on top of updates or willing to reboot it, you go multiple days without your normal data. I’ve contacted Whoop but they don’t give me any more assistance than what their chat bot and FAQ say, and this is something friends have also warned me about.

Additionally, the sync to Strava is also a subpar experience. Unless you track a workout with all your reps and sets live, it will prematurely send your activity to Strava before you have added in your workout to calculate the proper strain and calories, thus making your workouts either slow and distracted, or your Strava data inaccurate. It does not update when you calculate muscular load or offer an option to send to Strava after you track your workout. Additionally, Whoop will automatically track an activity often incorrectly and send this. When you change it, changes not reflected in 3rd party apps it sends to. 

Also, the mapping and GPS capabilities are atrocious. Testing side by side with my Garmin, it is completely inaccurate and only gushes your steps and exertion fairly well. Always short changing and the battery dies fast. Compared to my very simple and easy-to-use Garmin instinct which I’ve had for 6 years and still has a great battery, easy to use and track workouts (including muscular load, reps & weight), Whoop has been more of a frustration. I am mainly using the sleep tracking data and other health monitor info which my Garmin doesn’t have, but instead of adding to my fitness enjoyment, it’s mostly a frustration. 

They also did not honor the referral I gave a friend. His device had Bluetooth issues.
Once he resolved and started using, they refused to give me a free month.",4.6.341,2025-05-02T14:52:59-07:00
12609152702,Sunyamurphy,5,Must have,"I’ve been wearing my Whoop for over a year and a half now and it’s not only been a perfect bio data collector in its accuracy but it’s also been a huge help in its design for me to take advantage of what is collected to improve my mental and physical health and wellbeing. From improving my sleep to helping me understand my own limitations so that I don’t get sick and overwhelmed by all of life’s challenges. I honestly don’t think that I can imagine ever getting rid of my Whoop. It’s just such an amazing tool for helping me to navigate through life, I don’t want to ever be without it again!",4.6.341,2025-05-01T20:04:41-07:00
12606860301,Sestrin,4,Widget?,"I’ve been a member since aug 20222. Great app, great device, great experience, but what happened to the widget in version 4.6.341?",4.6.341,2025-05-01T06:35:01-07:00
12606772921,Comrade Varma,3,Good but not the best,"The major thing I noticed in this is there is a huge difference in steps count when compared to apple watch while in indoors. It doesn’t have workouts like indoor walking or thread mill. No specific option for strength unless you add different exercise for regular exercises we do with dumbbells. No specific option for just core exercises. When working out with dumbbells though you feel the strain or weight as your hear beat doesn’t go that high, the strain in calculated is very low. These strains are completely based on heartbeats.",4.6.341,2025-05-01T06:09:38-07:00
12605045800,JRJUser,5,Great product and app...poor update,Have been consistent user of Whoop since 2020. Love the product and the general app experience. Just downloaded updated and already is crashing when I try to update alarm schedule. Please fix!,4.6.341,2025-04-30T19:07:03-07:00
12604587201,Ramakrishna Yella,4,App running on foreground all the time,"I like the app and tiles for all the metric it shows but the only thing that I do not like is that the app needs to be open 24x7 to collet the data. 
But running it in foreground is killing my battery. Would be good if this can be fixed by running in the background and collect live data.",4.6.341,2025-04-30T16:05:09-07:00
