review_id,author_name,rating,review_title,review_text,app_version,review_date
12358868987,Abdimamatovs,3,Add please Russian language,Please add Russian language,4.6.321,2025-02-26T15:12:49-07:00
12358237036,Brendandalelynch,1,Honest review from one of their longest customers,"I’m a diamond member and have been on whoop since it came out. It’s infuriating how little QC they have. Not to mention how they have no accountability for anything especially when it’s time to replace their faulty product. They have a feature called Strength trainer that has been out for a while now, and it still has the SAME bugs, including a consistent crash, that it had upon release. Imagine running a company and ignoring customers on such a large scale.",4.6.321,2025-02-26T11:14:16-07:00
12351100114,Anesthesia Student,5,Lots of USEFUL data,I’ve tried the Oura ring and the whoop strap. Whoop is by far more beneficial for physiological insights as well as sleep data. LOVE the fact that I don’t have to take it off to charge. App and interface will only get better.,4.6.321,2025-02-24T14:31:37-07:00
12350340792,I’m unsure_2007,2,Going downhill,"Amazing when it first came out but seriously…
TLDR: in 3 years the only meaningful update was journal+correlations on software, a bunch of clothes, and huge endorsements. Otherwise, I’m unsure what whoop is doing. They only need a 20 person team to do what they have accomplished.

My feedback:
- App needs a huge overhaul. It is one of the messiest and redundant-laden pieces of software on my device. It’s just a huge collection of descriptive statistics with a touch of correlations. 
- monthly and weekly reports need overhaul. Anyone with any experience with charts will tell you that there’s much more insightful ways of presenting the data
- Sensors need improvement. The accuracy, especially when doing any activity, is grossly delayed and inaccurate vs Polar (electro) or even Apple Watch (optical, like Whoop)
- Straps are an insane cash grab. Priced similar to Apple Watch straps, but last 6-8 mo vs my Apple ones last 2-3 years
- ‘AI’ is a joke. Mucks up answers most of the time. I exported data => GPT => asked same questions and the insights were FAR more useful
- Where is the 5.0? I’ve been paying $250/yr for 4 years now and only got the 4.0 upgrade…. Vs. Apple went from near-useless to full blown Ultra with similar functionality as Whoop with 3rd party apps in the same timeframe
- blah blah blah",4.6.320,2025-02-24T09:53:17-07:00
12347184676,randuchie,4,Trend pages etc falling off iPhone display,"I’ve been using Whoop for years and loving it. Recently informational pages like trends etc don’t fully display, they are overflowing off my iPhone display on both sides",4.6.320,2025-02-23T13:48:15-07:00
12346599687,Rania mhammed,5,Hi,I need help I don’t have data,4.6.320,2025-02-23T10:29:27-07:00
12331691124,MAliAbbass,5,Love this,"Amazing, had this for more than 4 years now and it’s an epic insight to what’s happening in your body and how daily habits affect our recovery",4.6.320,2025-02-19T17:37:54-07:00
12328209971,ForrestRobertsmtg,1,Terrible customer service!,Terrible customer service!,4.6.318,2025-02-18T20:45:13-07:00
12322258272,bkschilling,1,Strength Trainer,"ST is still glitchy. Not sure why its still so bad after all this time of being released, still an afterthought.",4.6.318,2025-02-17T07:59:17-07:00
12297250506,J3nnnn1f3r,1,"Promising Features, But Frustrating Connectivity Issues","The app looks great—too bad I can’t actually use it! My husband and I both got devices, but neither would pair or if it paired we’d get an error before it could set up our accounts. I tried everything: reinstalling, restarting. It even gave me two different UI versions. Support was helpful but no luck, so they sent a replacement. It worked! For two days. 😩Then it disconnected, kept clinging to the first device, and refused to sync data. A reset later, and now it thinks I need a free trial—despite our paid family plan. At this point, my truck and the nearest window are looking like solid troubleshooting options.",4.6.318,2025-02-11T00:07:45-07:00
12295928505,Ndiwnvduw,1,"Great idea, horrible app",The app barely works these days with the weight lifting feature not working at all. Look elsewhere for fitness tracking,4.6.318,2025-02-10T15:14:50-07:00
12292232744,Jen46284,1,Charges continue after “free” trial,I sent my device back after a week or so of a free trial. Turns out they continue to charge me $30 month when I HAD NO DEVICE AND NO APP. Stay away!!!,4.6.317,2025-02-09T17:03:50-07:00
12290448618,DubaiResident07,1,Daylight robbery,"The band quality is very poor, the app itself is buggy and wouldn’t even let me beyond the registration point. To think I paid for shipping to get it and shipping to send it back is really ridiculous. There should be some sort of audit on gadgets that are just downright useless.
My advice don’t buy it, better off with Garmin or Apple Watch.",4.6.317,2025-02-09T07:18:28-07:00
12289079428,ffffffxsefy,2,App needs major overhaul,"I usually never leave a review but for this app, I had to…  whoop band is nothing without the app so the app interface needs to be really easy to understand and the experience should be memorable. But the app is way too confusing. It’s hard to member where things are and it feels really cluttered. One day I might find something I never knew and the next day, I can’t find it again. Really really poor design of the app.",4.6.317,2025-02-08T23:42:40-07:00
12278729866,Zhelon,1,Add Spanish!,Please add spanish language!,4.6.317,2025-02-06T10:15:09-07:00
12275898527,Beksjodbdlcof,1,A Tremendous Waste of Money,"This is the single worst experience I have ever had with any company or product. Be warned that if you sign up for monthly payment options, WHOOP was very sure to guarantee you would be signing up for 12 consecutive months. If you’d like to cancel your membership, you can do so by paying for the entirety of the remaining 12 months in a lump sum. Customer service is useless, and any attempt at getting help with this is fruitless. This product is overhyped and wildly overpriced. Go buy an Apple Watch or a Garmin and spare yourself a headache.",4.6.317,2025-02-05T17:42:19-07:00
12263024447,420blazeiterryday,4,Journal,"If you guys could please please please let me label what medications I’m tracking in the journal, I’d really appreciate it. Generic “prescription x med” doesn’t remind me which one I’m tracking. :(((

Also: A lot of the graphs of data are cut off when I try to view them on my iPhone 12 mini. I have to find them on a desktop to read them.",4.6.316,2025-02-02T12:35:27-07:00
12258307641,Cng125,1,Widgets broken,Last update broke widgets on Lock Screen. 5 stars if fixed,4.6.316,2025-02-01T10:38:23-07:00
12255057220,HKK33,1,Useless customer service,The customer service is robotic and does not actually help. I was told I can cancel my membership and I qualify but they kept sending me instructions that does not work to do that one the app nor online. I lost almost 6  months of paid membership time. Very disappointing.,4.6.316,2025-01-31T17:05:25-07:00
12250483656,Pthork,2,Sync Issues,"It’s been like a year since I first noticed this problem of delayed syncing (12hrs or longer sometimes) even spamming the apps refresh doesn’t do jack. Super frustrating. There are insights into my health metrics I’d like to see in real time that I just can’t. If it weren’t for this major issue I’d give whoop 5 stars.

But like c’mon guys it’s been FOREVER and the problem is still ongoing. I started using my whoop again so sure this issue would’ve been fixed months ago, but nay. NAY!",4.6.316,2025-01-30T14:17:50-07:00
12250282063,Westowhop,1,Subscription,Please remove the need for a subscription or just make it Cheeper I would pay 5-10$ a month 100$ annually maybe,4.6.316,2025-01-30T13:02:48-07:00
12244482192,420blazeit4life,1,Garbage update,Recent update made this thing almost unusable.  Screens open randomly and the strap doesn’t stay synced the way it used to.  Please roll back the latest release it’s awful.,4.6.316,2025-01-29T03:13:25-07:00
12235827950,sw33tcarolin3,1,App is so buggy now,"Previously enjoyed using the app for many months, but this week the app is almost unusable. Random things keep opening like I clicked on them (but I did not), rendering me unable to view data I actually want to look at. Strongly considering no longer using my device if this isn’t resolved soon.",4.6.315,2025-01-26T21:15:51-07:00
12229210689,Kaleb Starr,4,Could use a superset functionality and UI improvements,"Could we get a superset functionality for strength trainer? It would be awesome to have a toggle so i can go down my list of exercises one set at a time.
Also why dont you guys support swipe functionality? Like swipe right to exit the menu/screen you are in. I feel like this is a standard that every single app supports.",4.6.315,2025-01-25T06:48:07-07:00
12224836716,JR_32,1,Great when working but awful support,"It’s great when it’s working but there are random data inconsistencies from time to time and support is unhelpful. Takes them very long to respond, if they do at all, and they don’t seem to least bit interested in fixing the issue. I’ve opened a few tickets now for missing and inaccurate data and sometimes get a response like a week or so later basically saying to check for updates or reboot. I’ve do the basic troubleshooting stuff but issues remain. For the amount we pay to subscribe there should be decent support.",4.6.315,2025-01-24T05:18:01-07:00
12220716655,Ratatatatatatatakata,3,The most recent update created more bugs,"Hi please fix the bugs. App is slower, opens random insights - please fix it",4.6.315,2025-01-23T05:08:33-07:00
12217554723,DBent_,1,Band won’t connect,Whoop won’t enter pairing mode despite being charged and having it for less than a month,4.6.315,2025-01-22T10:36:16-07:00
12213977387,Katie FPN,1,Terrible problem troubleshooting and customer service lately.,I’ve had an issue going on for a month and every rep that responds asks me for the same info (4 times) yet no one has responded with any info or a solution. New syncing issue I emailed about. They merged it with a sync issue from months ago. (That issue resolved itself and this is a new one as of today). How reliable is this data? How reliable is customer service? Has there been a change in the customer service model from previously? It used to be decent. Whoop is becoming something that is overpriced with no customer service and continuous issues. Sad.,4.6.315,2025-01-21T17:54:37-07:00
12211366075,tanyacristina,1,Very unhappy with product and customer support,"My whoop broke / stopped being able to go into pairing mode 2 weeks after buying it. Contacting customer support had been absolutely horrible, it’s been over 1 month since I messaged about the issue with a video and it’s still not resolved. Get it together whoop, terrible experience!",4.6.314,2025-01-21T03:45:27-07:00
12195230379,Frivovo,3,Not reliable w chronic illness,"Have had whoop for 4.5 years. Reliable for sleep (as accurate as sleep study) and strain, but recovery metrics are WAY off for peeps w chronic illness. It always counts low HRV as a - and high as a + and there is no way to adjust that. Hence ""green"" recovery while in a bad flare of autoimmune disease and ""red"" while getting better. Take the recovery stats w a BIG grain of salt if you have wonky HRV due to illness!",4.6.314,2025-01-17T05:56:47-07:00
12188925191,62633784,1,Scam charge,"Started to charge me without consent after I already canceled my membership for over a year. Just choose apple watch, this company is failing rapidly",4.6.314,2025-01-15T14:38:55-07:00
12181902031,NorahK123,3,What is going on lately???,"Love my Whoop. It has been a performance game changer 100%. I have had it a little over a year now and it has provided me with so much insight on my workouts and recovery. It has truly changed the game for me as an athlete. That being said, recent connectivity and app malfunctions are really getting in the way of my truly utilizing my Whoop. It consistently disconnects from Bluetooth mid workout, and lately it hasn’t been up dating my heart rate data so I am unable to log workouts. For example, today I went for a run and it disconnected multiple times during the run. Finally, it updated my workout about 2 hours later. I went for my strength session about an hour after my run. It has now been 6 hours since my training session and I have been unable to upload to strength trainer because it hasn’t uploaded information about my heart rate since my run. Also, I have been having trouble with the function of strength trainer as it won’t allow me to add additional sets. I upload the exercise, but the add button isn’t working when I try to add sets. This has been extremely frustrating as a truly do love my Whoop outside of these errors. I hope these issues are fixed soon or I will have to end my subscription.",4.6.314,2025-01-13T20:04:08-07:00
12176826153,0XxXxWxXxX0,2,Remove “Keep WHOOP App Open” Notifications,"The app is clean, well-designed, and easy to use. I would say that I’m largely happy with my WHOOP experience so far. However, the incessant reminders to keep the app open are incredibly annoying, and unnecessary. Syncing my device’s data takes very little time, so the constant requests to keep the app open only serve to bother users, and raise privacy concerns.",4.6.313,2025-01-12T12:35:50-07:00
12176226147,brav0charlie,2,The device is great. The app is a hot mess.,"Any benefits of using the device are overshadowed by the horribly clunky, non-intuitive mess of an app.

UX was a complete afterthought across the board, from data presentation to activity entry.",4.6.313,2025-01-12T09:33:07-07:00
12171033786,10n2010,1,Lifetime Warranty,Good luck trying to get a replacement for a defective part,4.6.313,2025-01-11T04:31:45-07:00
12167106340,CaffeineDan,1,Feels like android app,"It looks like the Whoop app is made by android engineers. It’s difficult to scroll between activities because the app cannot differentiate between scrolling and tapping. Randomly selects things, then you have to go back and start over. It’s literally an android app installed on an iPhone",4.6.313,2025-01-10T05:18:48-07:00
12163769798,adiogofilho,1,Horrible Experience,"From customer support to unauthorized charges after returning the device within the return window, I DONT recommend Whoop at all! They just improve a lot, beginning with their customer service.",4.6.313,2025-01-09T08:06:20-07:00
12163724443,victorel nazy,5,e,e,4.6.313,2025-01-09T07:52:55-07:00
12163672031,Heboo,1,Disappointed,"Dear Whoop support,
You sent my order to the wrong address, then I followed up with you after discovering the mistake, and yet I still haven’t received my whoop!! What else I should do! You just wasted a whole month.

You shouldn’t cut of the 3.0 version before receiving the 4.0, or at least don’t activate the membership till the user upgrade to the new device! 

I’m extremely disappointed.",4.6.313,2025-01-09T07:37:09-07:00
12156874645,MrJinxandMissLucy,1,SCAM DO NOT BUY,"Hopefully you’ll see this before you buy this $300 band. This app does not work. It bugs out on the create a profile workflow and doesn’t even allow you to link the band to the app. The band is completely useless without it. We basically set $300 on fire. 

THERE IS NO CUSTOMER SUPPORT. Zero. No one will get back to you to help. Not for a refund, not for a question. If you’re lucky you may get a bot reply about a non-related topic. 

Zero stars. Unethical company. DO NOT BUY.",4.6.312,2025-01-07T11:57:18-07:00
12155403239,Get a life please,3,Steps beta gotten worse,It was wildly inaccurate over counting. Then got very very accurate. Now wildly undercounting. How do I know? I also wear a pedometer.,4.6.312,2025-01-07T04:10:59-07:00
12144430125,Englishpancakes,3,Buggy but great functionality,In latest update 4.6.312 the keyboard blocks the journal text input on iOS 18. Makes it difficult to write something coherently.  Overall charts and data are helpful. Wish I could toggle notifications because I get too many.,4.6.312,2025-01-04T08:32:46-07:00
12139873518,Normally a chase fan,1,Whoop steals your last month of membership.,"I already paid for the entire month, but because I haven’t paid for the NEXT 24 months, they withhold the data and do not provide the product/service I already paid for. AKA STEALING. Easily my most regretted purchase of all time. Need I say any more? Junk app, data, service, and functionality. Cannot do anything right. Calling this a “smart” device or anything similar is outright comical. And to top it all off they now steal from you. I hope they go bankrupt and end up on the street",4.6.312,2025-01-03T06:31:29-07:00
12134083380,Andrew626,1,Garbage,Try to lock you into long term memberships just stick with an Apple Watch,4.6.312,2025-01-01T20:16:02-07:00
12125684318,Pkgolf,2,Current sw update issues,My whoop device and connectivity was fine till last app update. Now the connection to my phone is sporadic especially when working out.,4.6.312,2024-12-30T17:39:53-07:00
12120989907,Jeff.B.Apple,3,App and device ridden with bugs,"As a lot of people on here have already reviewed.  The tracking and app are extremely buggy and unreliable.  This is my third health tracker and have not had such an unfinished experience before (used oura, apple watch, garmin and polar trackers in the past). Sleep detection is extremely unreliable, and constantly running into bugs in the app.  It’s unfortunate I actually really enjoy the data given to you, especially the sleep debt load metric, but it’s turning out to be one of the most frustrating trackers I’ve used so far.  After my pre-paid year is up looking to discontinue use and just stick with Oura for far superior sleep tracking and apple watch for general activity and calorie tracking.",4.6.312,2024-12-29T12:32:49-07:00
12117656371,prestontaj,1,DO NOT BUY THE 30$ PLAN!!!,"It’s a year long commitment so it’s objectively worse than their annual plan. There is 0 reason to buy there monthly plan.

I was under the impression that I would pay month to month with the option to cancel without being charged 330$ if I decided to cancel in the first month.

Technically I was not lied to, however I would argue that the 30$ plan is intentionally deceptive",4.6.312,2024-12-28T16:14:31-07:00
12112087918,Shanika1109,1,Wacky policies,"It was pretty cool for the few weeks I could use it but then I was unable to use it for months (health reasons) and it was not possible to pause or cancel my subscription at all, and forced to pay whilst unable to work absolutely screwing with my credit score.",4.6.312,2024-12-27T07:36:27-07:00
12102839767,Azmatt25,1,No Cancel Option,Tried to work through multiple paths to avoid an annual renewal and finally had to freeze my credit card as last attempt to avoid it.  This is a disgusting way to ensnare a customer. User beware.,4.6.312,2024-12-24T22:13:54-07:00
12087098921,EZsGravity,5,Julie-Owner of Brain Life Center,Fantastic. I have an issue with energy due to Epstein Barr. I have had a difficult time trying to keep my body in balance. I have a tendency to push too hard when I work out which is not smart for me. Whoop helps me track it so well that I really can stay more stable and manage my energy. I am thankful. I am a 61 year old woman and find the data to be a motivating factor in making smarter choices for my health. I have started sharing this with my clients and am getting great feedback.,4.6.312,2024-12-20T18:59:55-07:00
12086918383,Dachkaah,1,Update issue???,"Been a loyal customer for over 3 years now. Have loved the product with the occasional issue here and there. But since the last update around the beginning of December, I believe, I have had nothing but problems. My band is always losing connection, constantly running behind on my syncing and the heart rate is all screwed up and inaccurate now. Not to mention, the battery is also not holding a charge like it used to. Not sure what they did but this is horrible. I have tried everything according to their support articles which I’m now realizing aren’t much help. They better get these issues fixed asap or they’ll be losing countless customers from the looks of it. Bummer cause it was such a great product.",4.6.312,2024-12-20T17:48:58-07:00
12077177771,immaculatemc,1,No Support,"WHOOP collects good data, but there is no support. My WHOOP just quit working one day and collecting data. And there was no way to return it. The little support on the app is totally designed to discourage you from asking Support questions. And there’s no directions on how to return a defective device. The hardware also feels extremely cheaply made.",4.6.312,2024-12-18T04:11:51-07:00
12076131515,Hvncngcnbv,5,Almost perfect,"I’m like 4-5 months into using my whoop. It requires a bit of patience, beyond the free trial really. Once you get 2 or 3 months of data then I felt like it really got a good sense for me. It’s gotten to a point where I’m genuinely able to feel the difference between a green and a yellow recover. The only issue I had was the journal, not being able to update as you go. You fixed it though! Now I can journal we things happen. Now if I could just transfer more data over to apple health, it’d be perfect. Buy a whoop! Seriously, I’m not a robot, buy it. Be healthy",4.6.312,2024-12-17T20:23:51-07:00
12071293154,anupnair,1,Non existent support,My Whoop stopped working / charging last week. Raised one ticket a day to see if I can get it sorted. No response at all from their membership services team - other than the automated email. It’s as if they don’t exist. Also called their support phone number. Heard some music for 40 minutes before I dropped that all. Complete waste of time.  Good product but terrible service model.,4.6.311,2024-12-16T12:17:32-07:00
12052246203,SaddenedUser,3,Help please!!!!!,"The device i have used for years cannot update to ios16.  And your software will not let me access all my previous years data.  I have since switched to a new device, buy am unable to access any of my previous information.",4.6.281,2024-12-11T12:24:41-07:00
12046103511,Whoop is bad,3,Doesn’t even work,Yesterday I wanted to see my recovery I didn’t show I thought it was a glitch but today I checked again nothing is showing,4.6.311,2024-12-09T21:38:54-07:00
12044767583,Psst Its Oscar,1,Whoop: Where Fitness Tracker Meets Financial Hostage Situation,"Returning the Whoop device within the trial window doesn’t necessarily guarantee that Whoop will not continue charging you for the returned device and membership for the whole of the 12 month minimum. 

It’s been now 15+ emails back and forth attempting to resolve this issue with their customer support team. The Whoop application and user management infrastructure is designed to be hard to navigate, bitterly difficult to get truly helpful customer service from, and most of all, impossible to end your membership through. 

It’s a relatively modern service yet it feels like the customer account service management of a gym circa 1985, where closing your membership was as easy and pain free as handing over a kidney of your first born son, Paulie Jr.",4.6.311,2024-12-09T12:08:42-07:00
12042406287,SR-MAZ,4,Great but,"Hi Whoop team, since the last update, I’ve noticed that the app disconnects from my device every 20-30 minutes or so. This has been a bit disruptive, especially during workouts and sleep tracking. I’ve tried reboot, restarting the app and my phone, forgetting the device, and pairing/unpairing, but the issue persists. I’d greatly appreciate it if you could look into this. Thank you for your hard work!",4.6.310,2024-12-08T20:51:10-07:00
12042083701,Uro Resident,1,Bad update,"New heart zones are much worse than how they were previously organized and do not help me accurately categorize the intensity of my work out.

Zone zero is too high and other zones are now too small.",4.6.310,2024-12-08T18:22:50-07:00
12038444520,mhutune,1,Worse customer service,"I have been using Whoop for over a year and appreciate the user-friendly interface and the detailed sleep tracking it offers. However, I have encountered some challenges with their customer service, as I have been unable to get a response regarding a charger that has stopped working. This isn't the first time I've experienced issues in this area. If I hadn't already committed to a subscription for the next year, I would consider alternatives like the Oura Ring or Garmin, which typically do not require ongoing subscriptions and have fewer components that might need replacing.",4.6.310,2024-12-07T19:42:19-07:00
12030421755,Iamundaunted,1,Date on app is stuck; customer support is slow,"Yesterdays date Dec 4 has been displayed all day and doesn’t change to todays date Dec 5. Uninstalled app, and device then reinstalled and reconnected device and it didn’t help. Reached out to customer support and i haven’t heard back. A lot of money for this problem not to get fixed.",4.6.310,2024-12-05T17:42:59-07:00
12029080015,Masai salvatore,5,Recomendación para ustedes,Me gusta usar mucho mi WHOOP para saber todo de mí pero también me gustaría poder enlazar mi app de whoop junto con mi calendario ya que noté que mi whoop tiene una alarma que me ayuda a levantarme en las mañanas si se asociaría con mi calendario sería fantástico y me sería mucho más útil en mi día a día,4.6.310,2024-12-05T09:09:37-07:00
12023268455,Jdiamond0404,5,Add poker,Y’all should add poker to activities. Would be cool to track,4.6.310,2024-12-03T20:03:39-07:00
