review_id,author_name,rating,review_title,review_text,app_version,review_date
13603539869,KCS2026,1,"Discontinued Brief, yet continued to mislead consumers about it being back ordered for years.","Discontinued Brief, yet continued to mislead consumers about it being back-ordered for years. For years waited, continuing to pay the annual fee. The sales folks that I spoke with were pleasant, but were not knowledgeable. Do better! They also did not reimburse me for the fee when they can see the device had not been used, because I was waiting for it to be restocked. Never happened. Going forward, if it’s not in stock I don’t  trust them.",5.34.0,2026-01-06T17:09:29-07:00
13600438474,pistolese,4,Whoop is amazing,"I love my whoop band. Have had it for a year now. It is the best device for tracking sleep, stress, heart rate, and recovery. The battery lasts over a week! My only complaint is that it’s subscription based.",5.33.0,2026-01-05T22:16:51-07:00
13593221655,Chicago Doug,1,Frustrating app with bad data,"Whoop grossly undercounts steps causing the app to give an elevated age to the user. The app’s algorithms are set so that it will only count steps if your arms are in swinging motion and even then it undercounts. As an example if I show 12,000 steps in Apple Health the Whoop app may show around 6500 steps. The AI function is extremely frustrating. Not able to continue previous conversations. Very difficult to navigate through the app to find where to check or change settings. The sleep tracking is invariably incorrect and when trying to add naps or added sleep it will then delete previously detected sleep. All of these issues cause the Age determination to be considerably off.",5.33.0,2026-01-04T03:25:40-07:00
13585882883,SteveChiagozie,2,"Great app, confusing UI, currently broken","I enjoy using the WHOOP app, although some of the features  feel buried in odd places in the UI. but currently you can’t chat with WHOOP Coach without the app freezing!",5.33.0,2026-01-02T08:33:44-07:00
13583952252,tomatoplantd,1,not good product. bad subscription policies. dont recommend getting this. app pretty useless,"bad design, bad product",5.33.0,2026-01-01T22:01:01-07:00
13582006539,Whoop rev1w,3,Get something else,"Way too inconsistent, decides when and when not it wants to track your data. I’d say get like any other health and fitness watch/app.",5.33.0,2026-01-01T10:39:52-07:00
13578480629,JordanHenricks,2,Unreliable charging,"Battery may show 6,255% charged one minute then 1% the next minute. Obviously glitchy. When charger is applied to charge it, it doesn’t even show as charging so you never know if it’s charging or not.",5.33.0,2025-12-31T13:33:31-07:00
13575318937,Dimes 2714,2,Inaccurate date,"I like to track my calories as part of overall health plan and whoop is WAY off in terms of calories tracking.  Also, it doesn’t show by hour only by day.  More accurate options available",5.33.0,2025-12-30T19:13:38-07:00
13574933912,anonymous736362,1,Terrible software,"Honestly the software is just plain terrible. You can't view anything from your home page while a workout is running (such as your recovery score). It doesn't tell you the cumulative minutes in each zone until you end the workout. And you need an internet connection to change or even just turn off your alarm . Better not plan on using your expensive screen less device for an alarm on a cruise or in the wilderness, it's a brick without an internet connection!",5.33.0,2025-12-30T16:50:23-07:00
13573640349,fluff daddy,4,Why does whoop think I’m pregnant?,"I have the WHOOP life band. The features are perfect for me. It really has been interesting to see how much my workouts improve on Green days.  It is also helped me to dial in a more consistent sleep pattern.

There are two things that really don’t make sense about WHOOP. First thing is, WHOOP thinks I’m pregnant.  I’m a man. I know we live in a modern age, but I’m not pregnant.  I even checked my profile and I am marked as a male.

Second thing is the constant disconnection from Bluetooth.  I am having to reconnect my device once or twice a week.  A small but annoying inconvenience.",5.33.0,2025-12-30T09:29:15-07:00
13570106569,Tejas Khot,3,Strength trainer unusable and buggy,Scrolling in the strength trainer doesn’t work and is extremely frustrating to use. Very annoying experience trying to get muscular load captured. Please fix soon!,5.33.0,2025-12-29T11:47:41-07:00
13569478419,Jole.Gott,1,Privacy Violation,"After returning the product because of discomfort with it, the app withheld my card information and won’t let me take it off or cancel membership unless i go through an extensive process over a service call that is extremely unprofessional outsourced to a loud call center. It is not easy to take yourself out of this contract!!! They make it as hard as possible with no proper customer service.",5.33.0,2025-12-29T08:36:08-07:00
13561825469,Amanda Jean Bouwski,1,Trying to cancel,To even get on the app you have to put your card information in for it to renew in a year for $200 and there is no where to cancel your membership once you get on the app.,5.33.0,2025-12-27T10:23:27-07:00
13561585251,Whoop ST Scroll,4,Strength Trainer,"Great feature, scroll when adding exercises does not work iOS please fix asap. Also glitchy ui when customizing reps and weights, done button hardly works",5.33.0,2025-12-27T09:09:48-07:00
13551987025,Beesnest55,1,Monetization over engagement,"The app prioritizes trying to make me share “free trials” and then the shop and monetization. Kind of a bummer for something this expensive and personalized… just bad product leadership. 

I can’t seem to customize the home screen to see heart rate (seems like something core, over selling me stuff)… despite the ai engine continuing to tell me there are pencils or customization buttons that actually aren’t there in my version. Again, just seems like bad product management. Our family are not loving it thru day 1.",5.33.0,2025-12-24T20:02:22-07:00
13544073553,JamminWithJasmine,4,Good but needs word,"This thing rocks! The “Strength Trainer” function in the app needs to be further developed though. It’s clunky and you can’t see performance on past lifts while in a workout, which seems like an obvious feature to include.",5.33.0,2025-12-22T15:22:19-07:00
13537619021,Maxafa,2,Coach is glitching,"After any text is typed in the AI coach, the app freezes and no buttons work.",5.33.0,2025-12-20T22:41:37-07:00
13535504172,tim ocean,2,Stay on 4.0,"Recently upgraded from 4.0 to MG. MG feels cheaply made, the bands don’t seem to fit securely and already can’t get a two week old silicone band to clasp securely. Another company ruining their product chasing margins",5.33.0,2025-12-20T08:55:14-07:00
13534028573,GillsLuck,1,So close no matter how far,"Whoop has many cool features and awesome things to try like the ecg, blood pressure measure etc. it’s just too bad they don’t work. They might as well put “finds nearby unicorns”. Sick if it worked right? 100%. But it wouldn’t and it doesn’t. That’s whoop. I still get angry when I think about that I prepaid 12 months for this piece of garbage. Do yourself a favor and save yourself hours and hours of frustration by not buying this. I’d recommend making a nice beach fireplace and preferably just throw your money in there if you have too much of it. There’s no need to purchase bonus headaches, there’s plenty of free ones out there. If anyone employed at whoop reads this, which i doubt since they don’t read your own inbox (I’ve emailed twice with no response MONTHS AGO) then please just know that everyone makes mistakes and as there seemingly was a way back for Grima Wormtongue there’s a way back for you as well. I look more forward to my subscription ending than all the birthdays and xmases ever combined (included pre my birth). 

TLDR: it sucks. RUN THE OPPOSITE DIRDCTION",5.33.0,2025-12-20T00:33:48-07:00
13531978432,Ahmed aljafaari,5,Language,"We wish you continued success.
We respectfully request that you consider adding the Arabic language, as a large number of users of this application are Arabic speakers. Including Arabic would greatly facilitate proper understanding of the program and enhance user engagement. We kindly ask you to give this matter your serious consideration",5.33.0,2025-12-19T10:30:57-07:00
13529304699,jtm202006,1,Customer service is horrible,"Easy to get subscription but to cancel , you have no option. No customer service number to reach out to, the login doesn’t work on top of what I paid for one year, they are asking $199 to cancel the subscription.",5.33.0,2025-12-18T16:56:28-07:00
13528512391,Eeloj,3,Nice but,The app loves to crash. I can’t try and input data anymore since if I try to spend more then a minute on the app it just crashes. The app acts like it’s in 2019 and it hurts a bit to use.,5.33.0,2025-12-18T11:33:34-07:00
13526138170,RRQ,1,Sleep/Alarm,WTF did you do with the alarm? The best thing this app does is sleep and I can’t figure out where you idiots moved the alarm function.,5.33.0,2025-12-17T20:14:57-07:00
13521659130,Ahmed merzeh,1,دعم الغه,شوار ممتاز ولاكن مع الاسف لايدعم الغه العربيه,5.33.0,2025-12-16T14:22:27-07:00
13514184629,BigDinDa805,4,Heart rate detection during exercise is extremely inaccurate,"UPDATE: latest update to the app seems to have fixed the heart rate inaccuracy. 👍🏻 

I have WHOOP and an Apple Watch. During exercise, the whoop will randomly drop the heart rate reading. When my heart rate is between 150 and 160, the WHOOP will say it under 100 for an extended period of time and then jump back up to the accurate reading. The Apple Watch is entirely more accurate and doesn’t drop the reading mid work out. This is the only weakness of WHOOP that I have found, but it’s a big deal. An inaccurate heart reading impacts your strain for the day, the calories burned, and other things in the app. Please fix the heart rate monitor. Obviously it can be done better if Apple Watch works.",5.32.1,2025-12-14T13:27:38-07:00
13495559670,yanqize34,4,Looking Forward to Chinese Language Support,"I’ve been a long-time WHOOP user and really love the recovery and training insights. However, the app still doesn’t support Chinese, which makes it hard for my family and many potential users to use it. Could you please share if there’s any plan or estimated timeline for adding Chinese language support? It would greatly improve the experience for a huge user base. Looking forward to it!",5.32.1,2025-12-09T16:48:34-07:00
13494547073,Maddy LAMB,5,Daily Rhythm of Peace,"WHOOP has been far more than a fitness tracker to me — it has been a partner in my personal rebirth. Over the past year, this tiny band helped me rise into the woman God designed me to be. It showed me the truth about my sleep, my strain, my recovery, and my stress patterns… but more importantly, it revealed a deeper relationship between my faith, my mindset, and my physiology.

My Heart Rate Variability — a real, scientific marker of resilience — didn’t just inch upward… it transformed. It became visible, measurable evidence that my inner peace practice was literally reshaping my nervous system. I wasn’t just feeling different. WHOOP proved that I was different.

Every green recovery felt like God whispering, ‘You’re aligned.’
Every red day reminded me, ‘Rest is sacred.’
And watching my HRV rise became the key to my own inner vault — proof that peace, discipline, and divine alignment can be tracked, trained, and embodied.”

WHOOP helped me regulate my nervous system, rebuild consistency, restore trust with my body, and return to the woman of presence and power I thought I’d lost. It didn’t just optimize my life — it transformed my identity.

If you’re looking for something that doesn’t just measure data but reveals the blueprint of your becoming… WHOOP is it.",5.32.0,2025-12-09T10:28:57-07:00
13494529245,girll1999,1,The experience is putting me off,"I mean I am absolutely put off by how I can use the app. Why am I not able to see day view for heart rate, sleep etc. I do not understand how to use it, I am returning it. I am really sorry, there is a long way yo go",5.32.0,2025-12-09T10:22:54-07:00
13484382166,Ruler43,5,Beat fitness App,"I’ve used several fitness apps over the years and this is the most comprehensive, accurate and intuitive application I’ve used.",5.31.0,2025-12-06T19:38:24-07:00
13482632312,lpac123,2,Poor UI design,"Very poorly designed app, good product",5.31.0,2025-12-06T09:25:40-07:00
13479582490,Surya@1996,1,Worst customer Service,"The customer service at WHOOP is absolutely terrible. They seem to pour money into ads and publicity but can’t even provide a basic customer support phone number. I tried reaching them by email and the response was painfully slow. I paid for a life membership and still can’t properly access or proceed with my membership because there are no clear guidelines. The data is often inaccurate, I have to enter way too many details manually, and the sleep tracking is completely unreliable. Overall, this has been one of the worst service experiences I’ve ever had.",5.31.0,2025-12-05T15:39:02-07:00
13478711002,Loud’s Reviews,2,Family Membership Sucks,"There’s an inability to upgrade individual devices in the family plan. Whoop wants you to cancel the family plan, upgrade the device on the individual account, and then get on a new family plan. Doing this, you lose a ton of membership time and pay for multiple plans in a year. Fitness wise, it’s great but expensive.",5.31.0,2025-12-05T10:17:01-07:00
13478538861,BlackPrinceEd,1,No customer support,"Update: still using WHOOP after five years and still receiving insulting, patronizing service. They are still constantly out of stock and late in shipping. And also do not have accuracy with their orders leaving you to deal with the inept customer service again. 

This product works okay…the biggest decision factor is a frustrating and unhelpful product support team. You will spend time describing issues to them, only to have them send you scripted, one-size-fits all responses.

Whoop is an over promise, under deliver company.",5.31.0,2025-12-05T09:21:01-07:00
13472964457,Rocklage,5,Absolutely abhorrent,"I have had whoop for 2 days now. And I have had to reach out to the customer support 3 times (3 different issues)

1. The sleep never got tracked for the first night. I thought it might be calibration stuff. But no it was not.

2. On the second day the app just did not log any activity whatsoever. There were no step counts, no calories, nothing at all. 

3. Then half past midnight on the third day everything got logged but to my utter disbelief, all data for day 2 was logged as if it happened on day 3. I mean the day had just started and half an hour into 3rd day it logged 5000 steps and 2500 calories. Ofcourse day 2’s data was still missing. 

What a joke….!!!",5.31.0,2025-12-03T22:42:34-07:00
13469984584,Bhuccyn. Bufbn,2,It doesn’t work all the time,Many times the whoop didn’t read the data from my sleep and or workout. Lot of times it also say the whoop is off my body even though it’s not,5.31.0,2025-12-03T04:13:09-07:00
13456032307,darshington,2,Heart Rate monitor very inaccurate,"Cool idea for a product, execution poor. Heart rate monitoring terribly inaccurate. The harder I print the lower my heart rate goes. Tried multiple versions an even retuned latest model once because I thought it was defective but that’s just the product. Apple Watch and chest straps superior. Customer service was useless. Said it was my fault.",5.30.0,2025-11-29T12:24:14-07:00
13452897450,Graf.uz.,1,Account Access Issues Led to Membership Cancellation,"I am discontinuing my WHOOP membership due to ongoing issues accessing my account. Despite multiple attempts to resolve the problem through email, phone, and chat support, the issue remained unresolved. As a result, I was unable to use the service while continuing to be billed, which is unacceptable for a subscription-based product.

While I initially enjoyed the WHOOP experience, the lack of effective technical support and the inability to regain access to my account ultimately left me with no choice but to cancel. I hope WHOOP improves its account recovery process and customer support responsiveness moving forward.",5.30.0,2025-11-28T18:01:56-07:00
13450839138,Jmunoz11782,5,Hands down the best health and fitness wearable on the market,"I’ve been a WHOOP member for two years. I’m obsessed, it’s one of the only apps I use every day. It is super user-friendly and customizable. It’s helped me to realize some bad habits that I had that affected my sleep and ability to recover after difficult workouts. I love the minimalistic look of the band, which allows me to wear it along with a mechanical watch and not having notifications buzzing on my wrist has been anxiety reducing. Now they have incorporated lab work into their platform, which is in my opinion it came changing addition to be able to see how your sleep and exercise habits impact your body on a deeper level and make adjustments accordingly. This is a life-changing device and platform that they continue to improve.",5.30.0,2025-11-28T06:40:22-07:00
13442060160,akopanev-21,1,Bugs,"Sleep not detected… whoop is not on the body… lot of things ruin experience, thinking about going back to Garmin",5.30.0,2025-11-25T22:36:13-07:00
13434123486,joeymp,4,"Great Product, hoping to see it even better!",I think the Whoop concept is awesome. I have the Life membership and have also purchased blood tests and opted to participate in studies. My one request: continue the partnership/integration with Withings. I have a wireless BP monitor that would be amazing the data could be automatically brought into the Whoop app for tracking.,5.30.0,2025-11-23T19:54:52-07:00
13431987492,Shayan 3,1,Customer Service,They have the worst customer service and they charge your card without your knowledge,5.30.0,2025-11-23T07:02:48-07:00
13430266801,Cpweaver01,1,Horrible experience,Everything this is suppose to do is based off of heart rate and its sensor is just not poor at this it’s unacceptable. While simultaneously wearing a polar H 10 heart rate strap and the WHOOP the difference between readings was astronomical the accurate H 10 had me at 144 bpm for two hours during a bike ride when the WHOOP sensor had me at an average of 106 bpm for that same two hours. Super disappointed. And since it uses heart rate to calculate all of the information it’s trying to get to tell you what to do. It’s just not accurate information so basically a waste of money and  time.,5.30.0,2025-11-22T20:02:27-07:00
13414304617,Jayson is real,1,.,"Horrible, they charged my card 116 after the free trial",5.30.0,2025-11-18T13:54:39-07:00
13411293222,Mafferik,1,Advanced Labs not ready for prime time,"This review is for Whoop’s Advanced Labs only. After 35 days since my blood test I’m still waiting for my health recommendations. The process seems to be stuck due to a bug, according to the app 64 out of 65 bio markers are in, but that pesky last one stops the entire machine in its tracks. Support is useless and washes its hands of ownership as it points to the outsourced medical partner. Not great. Even after pointing out the bug, an incalculable biomarker, nothing. Disappointed.",5.30.0,2025-11-17T19:06:49-07:00
13405581982,Naveen1020,3,Widgets don’t work anymore.,"I like the app, but the widgets don’t work anymore these days.",5.29.1,2025-11-16T08:09:24-07:00
13402907569,G-Dawg1997,1,Can’t pair new device,"Can’t pair new device on the 15promax as the CTA on the screen for pairing is hidden and can’t be pressed 
Please fix",5.29.1,2025-11-15T16:17:41-07:00
13401993631,ORIO11,5,Really is the best,"So I have been very skeptical of the whoop, so many people hate on it because of the membership and other reasons around accuracy. 

However, I have tested it for myself against my apple watch, my oura ring, my garmin and coros watch lol. 

Honestly apple is the best when it comes to HR tracking. But they do not give you any insights, or use any sort of algorithmic analysis tool which is really where the magic happens. 

Whoop is absolutely accurate enough on Hr data for the use case’s its intended for. Pair that with the algorithms they use and constant analysis against many other markers and you have the best health and fitness tool on the market. Ive seen countless videos on youtube saying how apple watch with athylitic or bevel are just as good if not better. I personally do not agree. Those apps dont have great UX, the results are confusing and dont seem super accurate to me. However they compile data and analyze it just isnt at the level of whoop. 

The whoop is comfortable and thr app is really amazing. I love the interface, the data makes a lot of sense and its easy to understand and make actionable choices with it. Its super focused on gives me exactly what i need and nothing more that i dont. I hear some people asking for nutrition tracking… please dont lol its just another manual task that is calorie focused and not very accurate in my opinion. It kind of grtd away from thr whole athletics and performance tracker and makes it more of a wellness tool. 

Keep up the great work, I love everything about the whoop mg and what it has to offer, there isnt a feature on here I dont use.",5.29.1,2025-11-15T10:52:51-07:00
13399263105,reidhunter243,4,Apple Watch App,Please make an Apple Watch app. Would love to have whoop visibility somewhere without pulling out my phone.,5.29.1,2025-11-14T19:57:06-07:00
13383510131,keller2021,1,Worst app ever,"First offering a free trial with the device and then when you come to cancel it, it charges you nine dollars for the returning fee and you have to return the device or they’ll charge you $110 restocking fee inconvenient and not mentioned in the beginning.",5.29.1,2025-11-10T22:27:36-07:00
13375010260,Fugfuhghgf,1,Почему нет русского языка?,"В момент когда нейросеть может перевести абсолютно, все и вы зная о пользователях говорящих на русском языке по всему миру не добавляете русский язык уже несколько лет? Ну позор же!",5.28.0,2025-11-08T21:21:48-07:00
13374799461,vijju529,3,Doesn’t sync nutrition data from apple health!,"Loving whoop so far but the app doesn’t seem to sync calorie intake and nutrition data which is already present in apple health, which I provide through another app! Please fix this issue!",5.28.0,2025-11-08T19:58:15-07:00
13373421174,AHairyPrepper,1,Beware Bait and Switch,"I chose Whoop over other, less expensive  options for a premium experience. I signed up for the Whoop peak plan which includes a 5.0 device. I received the 4.0 device instead (still charged for the Peak plan). Customer support wont send me the 5.0 device (included in the plan)  unless I renew for ANOTHER YEAR. I still have like 8 months left on my membership. What a scam.  Why on earth would I renew this service if they won’t honor their own plan promises?",5.28.0,2025-11-08T11:41:23-07:00
13372703932,big body bad boy,1,Scam Artists,Beware of these scammers don’t give them your card because you will get charged indefinitely,5.28.0,2025-11-08T08:15:51-07:00
13366239825,Evil atheist,1,Do not force me to provide a card,Why will the app not allow me to cancel my membership while maintaining the rest of my subscription period? Immediately burning bridges right out the gate!,5.28.0,2025-11-06T19:47:51-07:00
13363625607,dissapoontedcustomer,4,Everything mostly good but recovery insights need improvements,“Recovery Insights” need to be improved so it doesn’t just try to correlate behaviors with your recovery. It’s absurd that behaviors that are known to be negative show up as positive just because they correlate with a good night sleep. I just got “back pain” having a +4% positive impact on my recovery and “congestion” having a +2% impact.,5.28.0,2025-11-06T05:21:09-07:00
13343900445,Sfnick8,1,Won’t redownload to new iPhone 17 pro,Every other app has downloaded and worked on new iPhone except Whoop. Really frustrated by lack of support and now my useless whoop. Latest updates haven’t worked. Still not working,5.27.0,2025-11-01T13:48:30-07:00
13342022498,RohithGadde,1,Unable to schedule whoop advanced labs test.,I purchased the whoop labs test and later when I tried to schedule it the app keeps crashing saying something went wrong try again. I tried doing it multiple times but still no use.,5.27.0,2025-11-01T05:35:16-07:00
13340773675,ansayedmoussa,1,Regret Buying It — Apple Watch Wins Easily,"If I could go back in time, I wouldn’t have bought it it’s completely useless. The Apple Watch is way better at least it doesn’t require a subscription.",5.27.0,2025-10-31T22:30:32-07:00
